2024-04-09 15:35:31.343483 IP 192.168.191.130.39488 > 192.168.191.128.2222: Flags [S], seq 1966554739, win 64240, options [mss 1460,sackOK,TS val 1103506365 ecr 0,nop,wscale 7], length 0
2024-04-09 15:35:31.343577 IP 192.168.191.128.2222 > 192.168.191.130.39488: Flags [S.], seq 4206789830, ack 1966554740, win 31856, options [mss 1460,sackOK,TS val 1994956457 ecr 1103506365,nop,wscale 7], length 0
2024-04-09 15:35:31.343813 IP 192.168.191.130.39488 > 192.168.191.128.2222: Flags [.], ack 1, win 502, options [nop,nop,TS val 1103506366 ecr 1994956457], length 0
2024-04-09 15:35:31.344027 IP 192.168.191.130.39488 > 192.168.191.128.2222: Flags [P.], seq 1:33, ack 1, win 502, options [nop,nop,TS val 1103506366 ecr 1994956457], length 32
2024-04-09 15:35:31.344053 IP 192.168.191.128.2222 > 192.168.191.130.39488: Flags [.], ack 33, win 249, options [nop,nop,TS val 1994956457 ecr 1103506366], length 0
2024-04-09 15:35:31.345837 IP 192.168.191.128.2222 > 192.168.191.130.39488: Flags [P.], seq 1:664, ack 33, win 249, options [nop,nop,TS val 1994956459 ecr 1103506366], length 663
2024-04-09 15:35:31.346112 IP 192.168.191.130.39488 > 192.168.191.128.2222: Flags [.], ack 664, win 501, options [nop,nop,TS val 1103506368 ecr 1994956459], length 0
2024-04-09 15:35:31.346279 IP 192.168.191.130.39488 > 192.168.191.128.2222: Flags [P.], seq 33:1537, ack 664, win 501, options [nop,nop,TS val 1103506368 ecr 1994956459], length 1504
2024-04-09 15:35:31.346309 IP 192.168.191.128.2222 > 192.168.191.130.39488: Flags [.], ack 1537, win 249, options [nop,nop,TS val 1994956460 ecr 1103506368], length 0
2024-04-09 15:35:31.347234 IP 192.168.191.130.39488 > 192.168.191.128.2222: Flags [P.], seq 1537:1585, ack 664, win 501, options [nop,nop,TS val 1103506369 ecr 1994956460], length 48
2024-04-09 15:35:31.348072 IP 192.168.191.128.2222 > 192.168.191.130.39488: Flags [P.], seq 664:872, ack 1585, win 249, options [nop,nop,TS val 1994956461 ecr 1103506369], length 208
2024-04-09 15:35:31.348645 IP 192.168.191.130.39488 > 192.168.191.128.2222: Flags [F.], seq 1585, ack 872, win 501, options [nop,nop,TS val 1103506371 ecr 1994956461], length 0
2024-04-09 15:35:31.348774 IP 192.168.191.128.2222 > 192.168.191.130.39488: Flags [F.], seq 872, ack 1586, win 249, options [nop,nop,TS val 1994956462 ecr 1103506371], length 0
2024-04-09 15:35:31.348983 IP 192.168.191.130.39488 > 192.168.191.128.2222: Flags [.], ack 873, win 501, options [nop,nop,TS val 1103506371 ecr 1994956462], length 0
2024-04-09 15:35:36.539271 IP 192.168.191.130.44852 > 192.168.191.128.2222: Flags [S], seq 1463101884, win 64240, options [mss 1460,sackOK,TS val 1103511561 ecr 0,nop,wscale 7], length 0
2024-04-09 15:35:36.539360 IP 192.168.191.128.2222 > 192.168.191.130.44852: Flags [S.], seq 2622843132, ack 1463101885, win 31856, options [mss 1460,sackOK,TS val 1994961653 ecr 1103511561,nop,wscale 7], length 0
2024-04-09 15:35:36.539570 IP 192.168.191.130.44852 > 192.168.191.128.2222: Flags [.], ack 1, win 502, options [nop,nop,TS val 1103511561 ecr 1994961653], length 0
2024-04-09 15:35:36.539804 IP 192.168.191.130.44852 > 192.168.191.128.2222: Flags [P.], seq 1:33, ack 1, win 502, options [nop,nop,TS val 1103511562 ecr 1994961653], length 32
2024-04-09 15:35:36.539827 IP 192.168.191.128.2222 > 192.168.191.130.44852: Flags [.], ack 33, win 249, options [nop,nop,TS val 1994961653 ecr 1103511562], length 0
2024-04-09 15:35:36.540972 IP 192.168.191.128.2222 > 192.168.191.130.44852: Flags [P.], seq 1:664, ack 33, win 249, options [nop,nop,TS val 1994961654 ecr 1103511562], length 663
2024-04-09 15:35:36.541199 IP 192.168.191.130.44852 > 192.168.191.128.2222: Flags [.], ack 664, win 501, options [nop,nop,TS val 1103511563 ecr 1994961654], length 0
2024-04-09 15:35:36.541432 IP 192.168.191.130.44852 > 192.168.191.128.2222: Flags [P.], seq 33:1537, ack 664, win 501, options [nop,nop,TS val 1103511563 ecr 1994961654], length 1504
2024-04-09 15:35:36.541456 IP 192.168.191.128.2222 > 192.168.191.130.44852: Flags [.], ack 1537, win 249, options [nop,nop,TS val 1994961655 ecr 1103511563], length 0
2024-04-09 15:35:36.542362 IP 192.168.191.130.44852 > 192.168.191.128.2222: Flags [P.], seq 1537:1585, ack 664, win 501, options [nop,nop,TS val 1103511564 ecr 1994961655], length 48
2024-04-09 15:35:36.542905 IP 192.168.191.128.2222 > 192.168.191.130.44852: Flags [P.], seq 664:872, ack 1585, win 249, options [nop,nop,TS val 1994961656 ecr 1103511564], length 208
2024-04-09 15:35:36.586355 IP 192.168.191.130.44852 > 192.168.191.128.2222: Flags [.], ack 872, win 501, options [nop,nop,TS val 1103511608 ecr 1994961656], length 0
2024-04-09 15:35:38.134137 IP 192.168.191.130.44852 > 192.168.191.128.2222: Flags [P.], seq 1585:1601, ack 872, win 501, options [nop,nop,TS val 1103513156 ecr 1994961656], length 16
2024-04-09 15:35:38.134687 IP 192.168.191.128.2222 > 192.168.191.130.44852: Flags [P.], seq 872:984, ack 1601, win 249, options [nop,nop,TS val 1994963248 ecr 1103513156], length 112
2024-04-09 15:35:38.134889 IP 192.168.191.130.44852 > 192.168.191.128.2222: Flags [.], ack 984, win 501, options [nop,nop,TS val 1103513157 ecr 1994963248], length 0
2024-04-09 15:35:38.135783 IP 192.168.191.130.44852 > 192.168.191.128.2222: Flags [P.], seq 1601:1665, ack 984, win 501, options [nop,nop,TS val 1103513158 ecr 1994963248], length 64
2024-04-09 15:35:38.136086 IP 192.168.191.128.2222 > 192.168.191.130.44852: Flags [P.], seq 984:1048, ack 1665, win 249, options [nop,nop,TS val 1994963249 ecr 1103513158], length 64
2024-04-09 15:35:38.136314 IP 192.168.191.130.44852 > 192.168.191.128.2222: Flags [P.], seq 1665:1745, ack 1048, win 501, options [nop,nop,TS val 1103513158 ecr 1994963249], length 80
2024-04-09 15:35:38.136689 IP 192.168.191.128.2222 > 192.168.191.130.44852: Flags [P.], seq 1048:1128, ack 1745, win 249, options [nop,nop,TS val 1994963250 ecr 1103513158], length 80
2024-04-09 15:35:38.178483 IP 192.168.191.130.44852 > 192.168.191.128.2222: Flags [.], ack 1128, win 501, options [nop,nop,TS val 1103513200 ecr 1994963250], length 0
2024-04-09 15:35:42.759814 IP 192.168.191.130.44852 > 192.168.191.128.2222: Flags [P.], seq 1745:1905, ack 1128, win 501, options [nop,nop,TS val 1103517782 ecr 1994963250], length 160
2024-04-09 15:35:42.761595 IP 192.168.191.128.2222 > 192.168.191.130.44852: Flags [P.], seq 1128:1176, ack 1905, win 249, options [nop,nop,TS val 1994967875 ecr 1103517782], length 48
2024-04-09 15:35:42.761826 IP 192.168.191.130.44852 > 192.168.191.128.2222: Flags [.], ack 1176, win 501, options [nop,nop,TS val 1103517784 ecr 1994967875], length 0
2024-04-09 15:35:42.761950 IP 192.168.191.130.44852 > 192.168.191.128.2222: Flags [P.], seq 1905:2065, ack 1176, win 501, options [nop,nop,TS val 1103517784 ecr 1994967875], length 160
2024-04-09 15:35:42.762311 IP 192.168.191.128.2222 > 192.168.191.130.44852: Flags [P.], seq 1176:1240, ack 2065, win 249, options [nop,nop,TS val 1994967876 ecr 1103517784], length 64
2024-04-09 15:35:42.762752 IP 192.168.191.130.44852 > 192.168.191.128.2222: Flags [P.], seq 2065:2577, ack 1240, win 501, options [nop,nop,TS val 1103517784 ecr 1994967876], length 512
2024-04-09 15:35:42.780938 IP 192.168.191.128.2222 > 192.168.191.130.44852: Flags [P.], seq 1240:1816, ack 2577, win 249, options [nop,nop,TS val 1994967894 ecr 1103517784], length 576
2024-04-09 15:35:42.822378 IP 192.168.191.130.44852 > 192.168.191.128.2222: Flags [.], ack 1816, win 501, options [nop,nop,TS val 1103517844 ecr 1994967894], length 0
2024-04-09 15:35:43.952903 IP 192.168.191.130.44852 > 192.168.191.128.2222: Flags [P.], seq 2577:2641, ack 1816, win 501, options [nop,nop,TS val 1103518975 ecr 1994967894], length 64
2024-04-09 15:35:43.953462 IP 192.168.191.128.2222 > 192.168.191.130.44852: Flags [P.], seq 1816:1880, ack 2641, win 249, options [nop,nop,TS val 1994969067 ecr 1103518975], length 64
2024-04-09 15:35:43.953655 IP 192.168.191.130.44852 > 192.168.191.128.2222: Flags [.], ack 1880, win 501, options [nop,nop,TS val 1103518975 ecr 1994969067], length 0
2024-04-09 15:35:44.110146 IP 192.168.191.130.44852 > 192.168.191.128.2222: Flags [P.], seq 2641:2705, ack 1880, win 501, options [nop,nop,TS val 1103519132 ecr 1994969067], length 64
2024-04-09 15:35:44.110660 IP 192.168.191.128.2222 > 192.168.191.130.44852: Flags [P.], seq 1880:1944, ack 2705, win 249, options [nop,nop,TS val 1994969224 ecr 1103519132], length 64
2024-04-09 15:35:44.110904 IP 192.168.191.130.44852 > 192.168.191.128.2222: Flags [.], ack 1944, win 501, options [nop,nop,TS val 1103519133 ecr 1994969224], length 0
2024-04-09 15:35:44.522450 IP 192.168.191.130.44852 > 192.168.191.128.2222: Flags [P.], seq 2705:2769, ack 1944, win 501, options [nop,nop,TS val 1103519544 ecr 1994969224], length 64
2024-04-09 15:35:44.523806 IP 192.168.191.128.2222 > 192.168.191.130.44852: Flags [P.], seq 1944:2200, ack 2769, win 249, options [nop,nop,TS val 1994969637 ecr 1103519544], length 256
2024-04-09 15:35:44.524026 IP 192.168.191.130.44852 > 192.168.191.128.2222: Flags [.], ack 2200, win 501, options [nop,nop,TS val 1103519546 ecr 1994969637], length 0
2024-04-09 15:35:44.718737 IP 192.168.191.130.44852 > 192.168.191.128.2222: Flags [P.], seq 2769:2833, ack 2200, win 501, options [nop,nop,TS val 1103519740 ecr 1994969637], length 64
2024-04-09 15:35:44.719246 IP 192.168.191.128.2222 > 192.168.191.130.44852: Flags [P.], seq 2200:2264, ack 2833, win 249, options [nop,nop,TS val 1994969833 ecr 1103519740], length 64
2024-04-09 15:35:44.719430 IP 192.168.191.130.44852 > 192.168.191.128.2222: Flags [.], ack 2264, win 501, options [nop,nop,TS val 1103519741 ecr 1994969833], length 0
2024-04-09 15:35:44.904130 IP 192.168.191.130.44852 > 192.168.191.128.2222: Flags [P.], seq 2833:2897, ack 2264, win 501, options [nop,nop,TS val 1103519926 ecr 1994969833], length 64
2024-04-09 15:35:44.904613 IP 192.168.191.128.2222 > 192.168.191.130.44852: Flags [P.], seq 2264:2328, ack 2897, win 249, options [nop,nop,TS val 1994970018 ecr 1103519926], length 64
2024-04-09 15:35:44.904823 IP 192.168.191.130.44852 > 192.168.191.128.2222: Flags [.], ack 2328, win 501, options [nop,nop,TS val 1103519927 ecr 1994970018], length 0
2024-04-09 15:35:45.614890 IP 192.168.191.130.44852 > 192.168.191.128.2222: Flags [P.], seq 2897:2961, ack 2328, win 501, options [nop,nop,TS val 1103520637 ecr 1994970018], length 64
2024-04-09 15:35:45.615356 IP 192.168.191.128.2222 > 192.168.191.130.44852: Flags [P.], seq 2328:2392, ack 2961, win 249, options [nop,nop,TS val 1994970729 ecr 1103520637], length 64
2024-04-09 15:35:45.615551 IP 192.168.191.130.44852 > 192.168.191.128.2222: Flags [.], ack 2392, win 501, options [nop,nop,TS val 1103520637 ecr 1994970729], length 0
2024-04-09 15:35:45.808914 IP 192.168.191.130.44852 > 192.168.191.128.2222: Flags [P.], seq 2961:3025, ack 2392, win 501, options [nop,nop,TS val 1103520831 ecr 1994970729], length 64
2024-04-09 15:35:45.809410 IP 192.168.191.128.2222 > 192.168.191.130.44852: Flags [P.], seq 2392:2456, ack 3025, win 249, options [nop,nop,TS val 1994970923 ecr 1103520831], length 64
2024-04-09 15:35:45.809614 IP 192.168.191.130.44852 > 192.168.191.128.2222: Flags [.], ack 2456, win 501, options [nop,nop,TS val 1103520831 ecr 1994970923], length 0
2024-04-09 15:35:45.975102 IP 192.168.191.130.44852 > 192.168.191.128.2222: Flags [P.], seq 3025:3089, ack 2456, win 501, options [nop,nop,TS val 1103520997 ecr 1994970923], length 64
2024-04-09 15:35:45.975581 IP 192.168.191.128.2222 > 192.168.191.130.44852: Flags [P.], seq 2456:2520, ack 3089, win 249, options [nop,nop,TS val 1994971089 ecr 1103520997], length 64
2024-04-09 15:35:45.975774 IP 192.168.191.130.44852 > 192.168.191.128.2222: Flags [.], ack 2520, win 501, options [nop,nop,TS val 1103520997 ecr 1994971089], length 0
2024-04-09 15:35:46.126991 IP 192.168.191.130.44852 > 192.168.191.128.2222: Flags [P.], seq 3089:3153, ack 2520, win 501, options [nop,nop,TS val 1103521149 ecr 1994971089], length 64
2024-04-09 15:35:46.128137 IP 192.168.191.128.2222 > 192.168.191.130.44852: Flags [P.], seq 2520:2776, ack 3153, win 249, options [nop,nop,TS val 1994971242 ecr 1103521149], length 256
2024-04-09 15:35:46.128376 IP 192.168.191.130.44852 > 192.168.191.128.2222: Flags [.], ack 2776, win 501, options [nop,nop,TS val 1103521150 ecr 1994971242], length 0
2024-04-09 15:35:46.370258 IP 192.168.191.130.44852 > 192.168.191.128.2222: Flags [P.], seq 3153:3217, ack 2776, win 501, options [nop,nop,TS val 1103521392 ecr 1994971242], length 64
2024-04-09 15:35:46.370701 IP 192.168.191.128.2222 > 192.168.191.130.44852: Flags [P.], seq 2776:2840, ack 3217, win 249, options [nop,nop,TS val 1994971484 ecr 1103521392], length 64
2024-04-09 15:35:46.370898 IP 192.168.191.130.44852 > 192.168.191.128.2222: Flags [.], ack 2840, win 501, options [nop,nop,TS val 1103521393 ecr 1994971484], length 0
2024-04-09 15:35:46.495143 IP 192.168.191.130.44852 > 192.168.191.128.2222: Flags [P.], seq 3217:3281, ack 2840, win 501, options [nop,nop,TS val 1103521517 ecr 1994971484], length 64
2024-04-09 15:35:46.495659 IP 192.168.191.128.2222 > 192.168.191.130.44852: Flags [P.], seq 2840:2904, ack 3281, win 249, options [nop,nop,TS val 1994971609 ecr 1103521517], length 64
2024-04-09 15:35:46.495883 IP 192.168.191.130.44852 > 192.168.191.128.2222: Flags [.], ack 2904, win 501, options [nop,nop,TS val 1103521518 ecr 1994971609], length 0
2024-04-09 15:35:46.614888 IP 192.168.191.130.44852 > 192.168.191.128.2222: Flags [P.], seq 3281:3345, ack 2904, win 501, options [nop,nop,TS val 1103521637 ecr 1994971609], length 64
2024-04-09 15:35:46.616778 IP 192.168.191.128.2222 > 192.168.191.130.44852: Flags [P.], seq 2904:4824, ack 3345, win 249, options [nop,nop,TS val 1994971730 ecr 1103521637], length 1920
2024-04-09 15:35:46.616986 IP 192.168.191.130.44852 > 192.168.191.128.2222: Flags [.], ack 4824, win 496, options [nop,nop,TS val 1103521639 ecr 1994971730], length 0
2024-04-09 15:35:50.378178 IP 192.168.191.130.44852 > 192.168.191.128.2222: Flags [P.], seq 3345:3409, ack 4824, win 501, options [nop,nop,TS val 1103525400 ecr 1994971730], length 64
2024-04-09 15:35:50.378679 IP 192.168.191.128.2222 > 192.168.191.130.44852: Flags [P.], seq 4824:4888, ack 3409, win 249, options [nop,nop,TS val 1994975492 ecr 1103525400], length 64
2024-04-09 15:35:50.378905 IP 192.168.191.130.44852 > 192.168.191.128.2222: Flags [.], ack 4888, win 501, options [nop,nop,TS val 1103525400 ecr 1994975492], length 0
2024-04-09 15:35:50.521087 IP 192.168.191.130.44852 > 192.168.191.128.2222: Flags [P.], seq 3409:3473, ack 4888, win 501, options [nop,nop,TS val 1103525543 ecr 1994975492], length 64
2024-04-09 15:35:50.521612 IP 192.168.191.128.2222 > 192.168.191.130.44852: Flags [P.], seq 4888:4952, ack 3473, win 249, options [nop,nop,TS val 1994975635 ecr 1103525543], length 64
2024-04-09 15:35:50.521830 IP 192.168.191.130.44852 > 192.168.191.128.2222: Flags [.], ack 4952, win 501, options [nop,nop,TS val 1103525543 ecr 1994975635], length 0
2024-04-09 15:35:50.637064 IP 192.168.191.130.44852 > 192.168.191.128.2222: Flags [P.], seq 3473:3537, ack 4952, win 501, options [nop,nop,TS val 1103525659 ecr 1994975635], length 64
2024-04-09 15:35:50.637525 IP 192.168.191.128.2222 > 192.168.191.130.44852: Flags [P.], seq 4952:5016, ack 3537, win 249, options [nop,nop,TS val 1994975751 ecr 1103525659], length 64
2024-04-09 15:35:50.637733 IP 192.168.191.130.44852 > 192.168.191.128.2222: Flags [.], ack 5016, win 501, options [nop,nop,TS val 1103525659 ecr 1994975751], length 0
2024-04-09 15:35:50.787775 IP 192.168.191.130.44852 > 192.168.191.128.2222: Flags [P.], seq 3537:3601, ack 5016, win 501, options [nop,nop,TS val 1103525809 ecr 1994975751], length 64
2024-04-09 15:35:50.788274 IP 192.168.191.128.2222 > 192.168.191.130.44852: Flags [P.], seq 5016:5080, ack 3601, win 249, options [nop,nop,TS val 1994975902 ecr 1103525809], length 64
2024-04-09 15:35:50.788509 IP 192.168.191.130.44852 > 192.168.191.128.2222: Flags [.], ack 5080, win 501, options [nop,nop,TS val 1103525810 ecr 1994975902], length 0
2024-04-09 15:35:50.933020 IP 192.168.191.130.44852 > 192.168.191.128.2222: Flags [P.], seq 3601:3665, ack 5080, win 501, options [nop,nop,TS val 1103525955 ecr 1994975902], length 64
2024-04-09 15:35:50.933488 IP 192.168.191.128.2222 > 192.168.191.130.44852: Flags [P.], seq 5080:5144, ack 3665, win 249, options [nop,nop,TS val 1994976047 ecr 1103525955], length 64
2024-04-09 15:35:50.933680 IP 192.168.191.130.44852 > 192.168.191.128.2222: Flags [.], ack 5144, win 501, options [nop,nop,TS val 1103525955 ecr 1994976047], length 0
2024-04-09 15:35:56.232547 IP 192.168.191.130.44852 > 192.168.191.128.2222: Flags [P.], seq 3665:3729, ack 5144, win 501, options [nop,nop,TS val 1103531254 ecr 1994976047], length 64
2024-04-09 15:35:56.233742 IP 192.168.191.128.2222 > 192.168.191.130.44852: Flags [P.], seq 5144:5464, ack 3729, win 249, options [nop,nop,TS val 1994981347 ecr 1103531254], length 320
2024-04-09 15:35:56.233989 IP 192.168.191.130.44852 > 192.168.191.128.2222: Flags [.], ack 5464, win 501, options [nop,nop,TS val 1103531256 ecr 1994981347], length 0
2024-04-09 15:35:57.161915 IP 192.168.191.130.44852 > 192.168.191.128.2222: Flags [P.], seq 3729:3793, ack 5464, win 501, options [nop,nop,TS val 1103532183 ecr 1994981347], length 64
2024-04-09 15:35:57.162393 IP 192.168.191.128.2222 > 192.168.191.130.44852: Flags [P.], seq 5464:5528, ack 3793, win 249, options [nop,nop,TS val 1994982276 ecr 1103532183], length 64
2024-04-09 15:35:57.162584 IP 192.168.191.130.44852 > 192.168.191.128.2222: Flags [.], ack 5528, win 501, options [nop,nop,TS val 1103532184 ecr 1994982276], length 0
2024-04-09 15:35:57.258981 IP 192.168.191.130.44852 > 192.168.191.128.2222: Flags [P.], seq 3793:3857, ack 5528, win 501, options [nop,nop,TS val 1103532280 ecr 1994982276], length 64
2024-04-09 15:35:57.259498 IP 192.168.191.128.2222 > 192.168.191.130.44852: Flags [P.], seq 5528:5592, ack 3857, win 249, options [nop,nop,TS val 1994982373 ecr 1103532280], length 64
2024-04-09 15:35:57.259708 IP 192.168.191.130.44852 > 192.168.191.128.2222: Flags [.], ack 5592, win 501, options [nop,nop,TS val 1103532281 ecr 1994982373], length 0
2024-04-09 15:35:57.367082 IP 192.168.191.130.44852 > 192.168.191.128.2222: Flags [P.], seq 3857:3921, ack 5592, win 501, options [nop,nop,TS val 1103532388 ecr 1994982373], length 64
2024-04-09 15:35:57.369179 IP 192.168.191.128.2222 > 192.168.191.130.44852: Flags [P.], seq 5592:7512, ack 3921, win 249, options [nop,nop,TS val 1994982483 ecr 1103532388], length 1920
2024-04-09 15:35:57.369446 IP 192.168.191.130.44852 > 192.168.191.128.2222: Flags [.], ack 7512, win 496, options [nop,nop,TS val 1103532391 ecr 1994982483], length 0
2024-04-09 15:35:57.843942 IP 192.168.191.130.44852 > 192.168.191.128.2222: Flags [P.], seq 3921:3985, ack 7512, win 501, options [nop,nop,TS val 1103532865 ecr 1994982483], length 64
2024-04-09 15:35:57.844523 IP 192.168.191.128.2222 > 192.168.191.130.44852: Flags [P.], seq 7512:7576, ack 3985, win 249, options [nop,nop,TS val 1994982958 ecr 1103532865], length 64
2024-04-09 15:35:57.844721 IP 192.168.191.130.44852 > 192.168.191.128.2222: Flags [.], ack 7576, win 501, options [nop,nop,TS val 1103532866 ecr 1994982958], length 0
2024-04-09 15:35:58.027953 IP 192.168.191.130.44852 > 192.168.191.128.2222: Flags [P.], seq 3985:4049, ack 7576, win 501, options [nop,nop,TS val 1103533049 ecr 1994982958], length 64
2024-04-09 15:35:58.028512 IP 192.168.191.128.2222 > 192.168.191.130.44852: Flags [P.], seq 7576:7640, ack 4049, win 249, options [nop,nop,TS val 1994983142 ecr 1103533049], length 64
2024-04-09 15:35:58.028747 IP 192.168.191.130.44852 > 192.168.191.128.2222: Flags [.], ack 7640, win 501, options [nop,nop,TS val 1103533050 ecr 1994983142], length 0
2024-04-09 15:35:58.142954 IP 192.168.191.130.44852 > 192.168.191.128.2222: Flags [P.], seq 4049:4113, ack 7640, win 501, options [nop,nop,TS val 1103533164 ecr 1994983142], length 64
2024-04-09 15:35:58.143413 IP 192.168.191.128.2222 > 192.168.191.130.44852: Flags [P.], seq 7640:7704, ack 4113, win 249, options [nop,nop,TS val 1994983257 ecr 1103533164], length 64
2024-04-09 15:35:58.143599 IP 192.168.191.130.44852 > 192.168.191.128.2222: Flags [.], ack 7704, win 501, options [nop,nop,TS val 1103533165 ecr 1994983257], length 0
2024-04-09 15:35:58.613134 IP 192.168.191.130.44852 > 192.168.191.128.2222: Flags [P.], seq 4113:4177, ack 7704, win 501, options [nop,nop,TS val 1103533635 ecr 1994983257], length 64
2024-04-09 15:35:58.613640 IP 192.168.191.128.2222 > 192.168.191.130.44852: Flags [P.], seq 7704:7768, ack 4177, win 249, options [nop,nop,TS val 1994983727 ecr 1103533635], length 64
2024-04-09 15:35:58.613849 IP 192.168.191.130.44852 > 192.168.191.128.2222: Flags [.], ack 7768, win 501, options [nop,nop,TS val 1103533635 ecr 1994983727], length 0
2024-04-09 15:35:58.805941 IP 192.168.191.130.44852 > 192.168.191.128.2222: Flags [P.], seq 4177:4241, ack 7768, win 501, options [nop,nop,TS val 1103533827 ecr 1994983727], length 64
2024-04-09 15:35:58.806424 IP 192.168.191.128.2222 > 192.168.191.130.44852: Flags [P.], seq 7768:7832, ack 4241, win 249, options [nop,nop,TS val 1994983920 ecr 1103533827], length 64
2024-04-09 15:35:58.806620 IP 192.168.191.130.44852 > 192.168.191.128.2222: Flags [.], ack 7832, win 501, options [nop,nop,TS val 1103533828 ecr 1994983920], length 0
2024-04-09 15:35:58.896129 IP 192.168.191.130.44852 > 192.168.191.128.2222: Flags [P.], seq 4241:4305, ack 7832, win 501, options [nop,nop,TS val 1103533918 ecr 1994983920], length 64
2024-04-09 15:35:58.896663 IP 192.168.191.128.2222 > 192.168.191.130.44852: Flags [P.], seq 7832:7896, ack 4305, win 249, options [nop,nop,TS val 1994984010 ecr 1103533918], length 64
2024-04-09 15:35:58.896863 IP 192.168.191.130.44852 > 192.168.191.128.2222: Flags [.], ack 7896, win 501, options [nop,nop,TS val 1103533918 ecr 1994984010], length 0
2024-04-09 15:35:59.004818 IP 192.168.191.130.44852 > 192.168.191.128.2222: Flags [P.], seq 4305:4369, ack 7896, win 501, options [nop,nop,TS val 1103534026 ecr 1994984010], length 64
2024-04-09 15:35:59.005278 IP 192.168.191.128.2222 > 192.168.191.130.44852: Flags [P.], seq 7896:7960, ack 4369, win 249, options [nop,nop,TS val 1994984119 ecr 1103534026], length 64
2024-04-09 15:35:59.005492 IP 192.168.191.130.44852 > 192.168.191.128.2222: Flags [.], ack 7960, win 501, options [nop,nop,TS val 1103534027 ecr 1994984119], length 0
2024-04-09 15:35:59.116798 IP 192.168.191.130.44852 > 192.168.191.128.2222: Flags [P.], seq 4369:4433, ack 7960, win 501, options [nop,nop,TS val 1103534138 ecr 1994984119], length 64
2024-04-09 15:35:59.117962 IP 192.168.191.128.2222 > 192.168.191.130.44852: Flags [P.], seq 7960:8232, ack 4433, win 249, options [nop,nop,TS val 1994984231 ecr 1103534138], length 272
2024-04-09 15:35:59.118149 IP 192.168.191.130.44852 > 192.168.191.128.2222: Flags [.], ack 8232, win 501, options [nop,nop,TS val 1103534140 ecr 1994984231], length 0
2024-04-09 15:35:59.320010 IP 192.168.191.130.44852 > 192.168.191.128.2222: Flags [P.], seq 4433:4497, ack 8232, win 501, options [nop,nop,TS val 1103534341 ecr 1994984231], length 64
2024-04-09 15:35:59.320560 IP 192.168.191.128.2222 > 192.168.191.130.44852: Flags [P.], seq 8232:8296, ack 4497, win 249, options [nop,nop,TS val 1994984434 ecr 1103534341], length 64
2024-04-09 15:35:59.320744 IP 192.168.191.130.44852 > 192.168.191.128.2222: Flags [.], ack 8296, win 501, options [nop,nop,TS val 1103534342 ecr 1994984434], length 0
2024-04-09 15:35:59.422879 IP 192.168.191.130.44852 > 192.168.191.128.2222: Flags [P.], seq 4497:4561, ack 8296, win 501, options [nop,nop,TS val 1103534444 ecr 1994984434], length 64
2024-04-09 15:35:59.423331 IP 192.168.191.128.2222 > 192.168.191.130.44852: Flags [P.], seq 8296:8360, ack 4561, win 249, options [nop,nop,TS val 1994984537 ecr 1103534444], length 64
2024-04-09 15:35:59.423631 IP 192.168.191.130.44852 > 192.168.191.128.2222: Flags [.], ack 8360, win 501, options [nop,nop,TS val 1103534445 ecr 1994984537], length 0
2024-04-09 15:35:59.567002 IP 192.168.191.130.44852 > 192.168.191.128.2222: Flags [P.], seq 4561:4625, ack 8360, win 501, options [nop,nop,TS val 1103534588 ecr 1994984537], length 64
2024-04-09 15:35:59.568409 IP 192.168.191.128.2222 > 192.168.191.130.44852: Flags [P.], seq 8360:8760, ack 4625, win 249, options [nop,nop,TS val 1994984682 ecr 1103534588], length 400
2024-04-09 15:35:59.568642 IP 192.168.191.130.44852 > 192.168.191.128.2222: Flags [.], ack 8760, win 501, options [nop,nop,TS val 1103534590 ecr 1994984682], length 0
2024-04-09 15:36:17.601273 IP 192.168.191.130.44852 > 192.168.191.128.2222: Flags [P.], seq 4625:4689, ack 8760, win 501, options [nop,nop,TS val 1103552622 ecr 1994984682], length 64
2024-04-09 15:36:17.601856 IP 192.168.191.128.2222 > 192.168.191.130.44852: Flags [P.], seq 8760:8824, ack 4689, win 249, options [nop,nop,TS val 1995002715 ecr 1103552622], length 64
2024-04-09 15:36:17.602063 IP 192.168.191.130.44852 > 192.168.191.128.2222: Flags [.], ack 8824, win 501, options [nop,nop,TS val 1103552623 ecr 1995002715], length 0
2024-04-09 15:36:17.676291 IP 192.168.191.130.44852 > 192.168.191.128.2222: Flags [P.], seq 4689:4753, ack 8824, win 501, options [nop,nop,TS val 1103552697 ecr 1995002715], length 64
2024-04-09 15:36:17.676816 IP 192.168.191.128.2222 > 192.168.191.130.44852: Flags [P.], seq 8824:8888, ack 4753, win 249, options [nop,nop,TS val 1995002790 ecr 1103552697], length 64
2024-04-09 15:36:17.677014 IP 192.168.191.130.44852 > 192.168.191.128.2222: Flags [.], ack 8888, win 501, options [nop,nop,TS val 1103552698 ecr 1995002790], length 0
2024-04-09 15:36:17.847401 IP 192.168.191.130.44852 > 192.168.191.128.2222: Flags [P.], seq 4753:4817, ack 8888, win 501, options [nop,nop,TS val 1103552869 ecr 1995002790], length 64
2024-04-09 15:36:17.847937 IP 192.168.191.128.2222 > 192.168.191.130.44852: Flags [P.], seq 8888:8952, ack 4817, win 249, options [nop,nop,TS val 1995002961 ecr 1103552869], length 64
2024-04-09 15:36:17.848152 IP 192.168.191.130.44852 > 192.168.191.128.2222: Flags [.], ack 8952, win 501, options [nop,nop,TS val 1103552869 ecr 1995002961], length 0
2024-04-09 15:36:17.981297 IP 192.168.191.130.44852 > 192.168.191.128.2222: Flags [P.], seq 4817:4881, ack 8952, win 501, options [nop,nop,TS val 1103553002 ecr 1995002961], length 64
2024-04-09 15:36:17.981812 IP 192.168.191.128.2222 > 192.168.191.130.44852: Flags [P.], seq 8952:9016, ack 4881, win 249, options [nop,nop,TS val 1995003095 ecr 1103553002], length 64
2024-04-09 15:36:17.982000 IP 192.168.191.130.44852 > 192.168.191.128.2222: Flags [.], ack 9016, win 501, options [nop,nop,TS val 1103553003 ecr 1995003095], length 0
2024-04-09 15:36:18.134304 IP 192.168.191.130.44852 > 192.168.191.128.2222: Flags [P.], seq 4881:4945, ack 9016, win 501, options [nop,nop,TS val 1103553155 ecr 1995003095], length 64
2024-04-09 15:36:18.134904 IP 192.168.191.128.2222 > 192.168.191.130.44852: Flags [P.], seq 9016:9080, ack 4945, win 249, options [nop,nop,TS val 1995003248 ecr 1103553155], length 64
2024-04-09 15:36:18.135117 IP 192.168.191.130.44852 > 192.168.191.128.2222: Flags [.], ack 9080, win 501, options [nop,nop,TS val 1103553156 ecr 1995003248], length 0
2024-04-09 15:36:18.520384 IP 192.168.191.130.44852 > 192.168.191.128.2222: Flags [P.], seq 4945:5009, ack 9080, win 501, options [nop,nop,TS val 1103553542 ecr 1995003248], length 64
2024-04-09 15:36:18.521001 IP 192.168.191.128.2222 > 192.168.191.130.44852: Flags [P.], seq 9080:9144, ack 5009, win 249, options [nop,nop,TS val 1995003634 ecr 1103553542], length 64
2024-04-09 15:36:18.521254 IP 192.168.191.130.44852 > 192.168.191.128.2222: Flags [.], ack 9144, win 501, options [nop,nop,TS val 1103553542 ecr 1995003634], length 0
2024-04-09 15:36:18.669113 IP 192.168.191.130.44852 > 192.168.191.128.2222: Flags [P.], seq 5009:5073, ack 9144, win 501, options [nop,nop,TS val 1103553690 ecr 1995003634], length 64
2024-04-09 15:36:18.669630 IP 192.168.191.128.2222 > 192.168.191.130.44852: Flags [P.], seq 9144:9208, ack 5073, win 249, options [nop,nop,TS val 1995003783 ecr 1103553690], length 64
2024-04-09 15:36:18.669847 IP 192.168.191.130.44852 > 192.168.191.128.2222: Flags [.], ack 9208, win 501, options [nop,nop,TS val 1103553691 ecr 1995003783], length 0
2024-04-09 15:36:18.833086 IP 192.168.191.130.44852 > 192.168.191.128.2222: Flags [P.], seq 5073:5137, ack 9208, win 501, options [nop,nop,TS val 1103553854 ecr 1995003783], length 64
2024-04-09 15:36:18.833675 IP 192.168.191.128.2222 > 192.168.191.130.44852: Flags [P.], seq 9208:9272, ack 5137, win 249, options [nop,nop,TS val 1995003947 ecr 1103553854], length 64
2024-04-09 15:36:18.833913 IP 192.168.191.130.44852 > 192.168.191.128.2222: Flags [.], ack 9272, win 501, options [nop,nop,TS val 1103553855 ecr 1995003947], length 0
2024-04-09 15:36:18.997396 IP 192.168.191.130.44852 > 192.168.191.128.2222: Flags [P.], seq 5137:5201, ack 9272, win 501, options [nop,nop,TS val 1103554019 ecr 1995003947], length 64
2024-04-09 15:36:18.997983 IP 192.168.191.128.2222 > 192.168.191.130.44852: Flags [P.], seq 9272:9336, ack 5201, win 249, options [nop,nop,TS val 1995004111 ecr 1103554019], length 64
2024-04-09 15:36:18.998210 IP 192.168.191.130.44852 > 192.168.191.128.2222: Flags [.], ack 9336, win 501, options [nop,nop,TS val 1103554019 ecr 1995004111], length 0
2024-04-09 15:36:19.419199 IP 192.168.191.130.44852 > 192.168.191.128.2222: Flags [P.], seq 5201:5265, ack 9336, win 501, options [nop,nop,TS val 1103554440 ecr 1995004111], length 64
2024-04-09 15:36:19.422402 IP 192.168.191.128.2222 > 192.168.191.130.44852: Flags [P.], seq 9336:9576, ack 5265, win 249, options [nop,nop,TS val 1995004536 ecr 1103554440], length 240
2024-04-09 15:36:19.422586 IP 192.168.191.130.44852 > 192.168.191.128.2222: Flags [.], ack 9576, win 501, options [nop,nop,TS val 1103554444 ecr 1995004536], length 0
2024-04-09 15:36:22.896250 IP 192.168.191.130.44852 > 192.168.191.128.2222: Flags [P.], seq 5265:5329, ack 9576, win 501, options [nop,nop,TS val 1103557917 ecr 1995004536], length 64
2024-04-09 15:36:22.896761 IP 192.168.191.128.2222 > 192.168.191.130.44852: Flags [P.], seq 9576:9640, ack 5329, win 249, options [nop,nop,TS val 1995008010 ecr 1103557917], length 64
2024-04-09 15:36:22.896961 IP 192.168.191.130.44852 > 192.168.191.128.2222: Flags [.], ack 9640, win 501, options [nop,nop,TS val 1103557918 ecr 1995008010], length 0
2024-04-09 15:36:23.039056 IP 192.168.191.130.44852 > 192.168.191.128.2222: Flags [P.], seq 5329:5393, ack 9640, win 501, options [nop,nop,TS val 1103558060 ecr 1995008010], length 64
2024-04-09 15:36:23.039611 IP 192.168.191.128.2222 > 192.168.191.130.44852: Flags [P.], seq 9640:9704, ack 5393, win 249, options [nop,nop,TS val 1995008153 ecr 1103558060], length 64
2024-04-09 15:36:23.039789 IP 192.168.191.130.44852 > 192.168.191.128.2222: Flags [.], ack 9704, win 501, options [nop,nop,TS val 1103558061 ecr 1995008153], length 0
2024-04-09 15:36:23.150235 IP 192.168.191.130.44852 > 192.168.191.128.2222: Flags [P.], seq 5393:5457, ack 9704, win 501, options [nop,nop,TS val 1103558171 ecr 1995008153], length 64
2024-04-09 15:36:23.150750 IP 192.168.191.128.2222 > 192.168.191.130.44852: Flags [P.], seq 9704:9768, ack 5457, win 249, options [nop,nop,TS val 1995008264 ecr 1103558171], length 64
2024-04-09 15:36:23.150955 IP 192.168.191.130.44852 > 192.168.191.128.2222: Flags [.], ack 9768, win 501, options [nop,nop,TS val 1103558172 ecr 1995008264], length 0
2024-04-09 15:36:23.409319 IP 192.168.191.130.44852 > 192.168.191.128.2222: Flags [P.], seq 5457:5521, ack 9768, win 501, options [nop,nop,TS val 1103558430 ecr 1995008264], length 64
2024-04-09 15:36:23.409822 IP 192.168.191.128.2222 > 192.168.191.130.44852: Flags [P.], seq 9768:9832, ack 5521, win 249, options [nop,nop,TS val 1995008523 ecr 1103558430], length 64
2024-04-09 15:36:23.410027 IP 192.168.191.130.44852 > 192.168.191.128.2222: Flags [.], ack 9832, win 501, options [nop,nop,TS val 1103558431 ecr 1995008523], length 0
2024-04-09 15:36:23.713339 IP 192.168.191.130.44852 > 192.168.191.128.2222: Flags [P.], seq 5521:5585, ack 9832, win 501, options [nop,nop,TS val 1103558734 ecr 1995008523], length 64
2024-04-09 15:36:23.713862 IP 192.168.191.128.2222 > 192.168.191.130.44852: Flags [P.], seq 9832:9896, ack 5585, win 249, options [nop,nop,TS val 1995008827 ecr 1103558734], length 64
2024-04-09 15:36:23.714053 IP 192.168.191.130.44852 > 192.168.191.128.2222: Flags [.], ack 9896, win 501, options [nop,nop,TS val 1103558735 ecr 1995008827], length 0
2024-04-09 15:36:23.816275 IP 192.168.191.130.44852 > 192.168.191.128.2222: Flags [P.], seq 5585:5649, ack 9896, win 501, options [nop,nop,TS val 1103558837 ecr 1995008827], length 64
2024-04-09 15:36:23.816814 IP 192.168.191.128.2222 > 192.168.191.130.44852: Flags [P.], seq 9896:9960, ack 5649, win 249, options [nop,nop,TS val 1995008930 ecr 1103558837], length 64
2024-04-09 15:36:23.817005 IP 192.168.191.130.44852 > 192.168.191.128.2222: Flags [.], ack 9960, win 501, options [nop,nop,TS val 1103558838 ecr 1995008930], length 0
2024-04-09 15:36:23.933297 IP 192.168.191.130.44852 > 192.168.191.128.2222: Flags [P.], seq 5649:5713, ack 9960, win 501, options [nop,nop,TS val 1103558954 ecr 1995008930], length 64
2024-04-09 15:36:23.935728 IP 192.168.191.128.2222 > 192.168.191.130.44852: Flags [P.], seq 9960:10568, ack 5713, win 249, options [nop,nop,TS val 1995009049 ecr 1103558954], length 608
2024-04-09 15:36:23.935999 IP 192.168.191.130.44852 > 192.168.191.128.2222: Flags [.], ack 10568, win 501, options [nop,nop,TS val 1103558957 ecr 1995009049], length 0
2024-04-09 15:36:31.835583 IP 192.168.191.130.44852 > 192.168.191.128.2222: Flags [P.], seq 5713:5777, ack 10568, win 501, options [nop,nop,TS val 1103566857 ecr 1995009049], length 64
2024-04-09 15:36:31.836246 IP 192.168.191.128.2222 > 192.168.191.130.44852: Flags [P.], seq 10568:10632, ack 5777, win 249, options [nop,nop,TS val 1995016950 ecr 1103566857], length 64
2024-04-09 15:36:31.836432 IP 192.168.191.130.44852 > 192.168.191.128.2222: Flags [.], ack 10632, win 501, options [nop,nop,TS val 1103566858 ecr 1995016950], length 0
2024-04-09 15:36:32.013522 IP 192.168.191.130.44852 > 192.168.191.128.2222: Flags [P.], seq 5777:5841, ack 10632, win 501, options [nop,nop,TS val 1103567035 ecr 1995016950], length 64
2024-04-09 15:36:32.014094 IP 192.168.191.128.2222 > 192.168.191.130.44852: Flags [P.], seq 10632:10696, ack 5841, win 249, options [nop,nop,TS val 1995017127 ecr 1103567035], length 64
2024-04-09 15:36:32.014306 IP 192.168.191.130.44852 > 192.168.191.128.2222: Flags [.], ack 10696, win 501, options [nop,nop,TS val 1103567035 ecr 1995017127], length 0
2024-04-09 15:36:32.082480 IP 192.168.191.130.44852 > 192.168.191.128.2222: Flags [P.], seq 5841:5905, ack 10696, win 501, options [nop,nop,TS val 1103567104 ecr 1995017127], length 64
2024-04-09 15:36:32.083054 IP 192.168.191.128.2222 > 192.168.191.130.44852: Flags [P.], seq 10696:10760, ack 5905, win 249, options [nop,nop,TS val 1995017196 ecr 1103567104], length 64
2024-04-09 15:36:32.083319 IP 192.168.191.130.44852 > 192.168.191.128.2222: Flags [.], ack 10760, win 501, options [nop,nop,TS val 1103567104 ecr 1995017196], length 0
2024-04-09 15:36:32.219403 IP 192.168.191.130.44852 > 192.168.191.128.2222: Flags [P.], seq 5905:5969, ack 10760, win 501, options [nop,nop,TS val 1103567240 ecr 1995017196], length 64
2024-04-09 15:36:32.219975 IP 192.168.191.128.2222 > 192.168.191.130.44852: Flags [P.], seq 10760:10824, ack 5969, win 249, options [nop,nop,TS val 1995017333 ecr 1103567240], length 64
2024-04-09 15:36:32.220192 IP 192.168.191.130.44852 > 192.168.191.128.2222: Flags [.], ack 10824, win 501, options [nop,nop,TS val 1103567241 ecr 1995017333], length 0
2024-04-09 15:36:32.390508 IP 192.168.191.130.44852 > 192.168.191.128.2222: Flags [P.], seq 5969:6033, ack 10824, win 501, options [nop,nop,TS val 1103567412 ecr 1995017333], length 64
2024-04-09 15:36:32.391044 IP 192.168.191.128.2222 > 192.168.191.130.44852: Flags [P.], seq 10824:10888, ack 6033, win 249, options [nop,nop,TS val 1995017504 ecr 1103567412], length 64
2024-04-09 15:36:32.391257 IP 192.168.191.130.44852 > 192.168.191.128.2222: Flags [.], ack 10888, win 501, options [nop,nop,TS val 1103567412 ecr 1995017504], length 0
2024-04-09 15:36:32.575564 IP 192.168.191.130.44852 > 192.168.191.128.2222: Flags [P.], seq 6033:6097, ack 10888, win 501, options [nop,nop,TS val 1103567597 ecr 1995017504], length 64
2024-04-09 15:36:32.576744 IP 192.168.191.128.2222 > 192.168.191.130.44852: Flags [P.], seq 10888:11144, ack 6097, win 249, options [nop,nop,TS val 1995017690 ecr 1103567597], length 256
2024-04-09 15:36:32.576915 IP 192.168.191.130.44852 > 192.168.191.128.2222: Flags [.], ack 11144, win 501, options [nop,nop,TS val 1103567598 ecr 1995017690], length 0
2024-04-09 15:36:33.162758 IP 192.168.191.130.44852 > 192.168.191.128.2222: Flags [P.], seq 6097:6161, ack 11144, win 501, options [nop,nop,TS val 1103568184 ecr 1995017690], length 64
2024-04-09 15:36:33.163360 IP 192.168.191.128.2222 > 192.168.191.130.44852: Flags [P.], seq 11144:11208, ack 6161, win 249, options [nop,nop,TS val 1995018277 ecr 1103568184], length 64
2024-04-09 15:36:33.163566 IP 192.168.191.130.44852 > 192.168.191.128.2222: Flags [.], ack 11208, win 501, options [nop,nop,TS val 1103568185 ecr 1995018277], length 0
2024-04-09 15:36:33.328716 IP 192.168.191.130.44852 > 192.168.191.128.2222: Flags [P.], seq 6161:6225, ack 11208, win 501, options [nop,nop,TS val 1103568350 ecr 1995018277], length 64
2024-04-09 15:36:33.329492 IP 192.168.191.128.2222 > 192.168.191.130.44852: Flags [P.], seq 11208:11272, ack 6225, win 249, options [nop,nop,TS val 1995018443 ecr 1103568350], length 64
2024-04-09 15:36:33.329692 IP 192.168.191.130.44852 > 192.168.191.128.2222: Flags [.], ack 11272, win 501, options [nop,nop,TS val 1103568351 ecr 1995018443], length 0
2024-04-09 15:36:34.914461 IP 192.168.191.130.44852 > 192.168.191.128.2222: Flags [P.], seq 6225:6289, ack 11272, win 501, options [nop,nop,TS val 1103569935 ecr 1995018443], length 64
2024-04-09 15:36:34.916314 IP 192.168.191.128.2222 > 192.168.191.130.44852: Flags [P.], seq 11272:13192, ack 6289, win 249, options [nop,nop,TS val 1995020030 ecr 1103569935], length 1920
2024-04-09 15:36:34.916550 IP 192.168.191.130.44852 > 192.168.191.128.2222: Flags [.], ack 13192, win 496, options [nop,nop,TS val 1103569938 ecr 1995020030], length 0
2024-04-09 15:36:36.898478 IP 192.168.191.130.44852 > 192.168.191.128.2222: Flags [P.], seq 6289:6353, ack 13192, win 501, options [nop,nop,TS val 1103571919 ecr 1995020030], length 64
2024-04-09 15:36:36.898986 IP 192.168.191.128.2222 > 192.168.191.130.44852: Flags [P.], seq 13192:13256, ack 6353, win 249, options [nop,nop,TS val 1995022012 ecr 1103571919], length 64
2024-04-09 15:36:36.899185 IP 192.168.191.130.44852 > 192.168.191.128.2222: Flags [.], ack 13256, win 501, options [nop,nop,TS val 1103571920 ecr 1995022012], length 0
2024-04-09 15:36:36.970570 IP 192.168.191.130.44852 > 192.168.191.128.2222: Flags [P.], seq 6353:6417, ack 13256, win 501, options [nop,nop,TS val 1103571992 ecr 1995022012], length 64
2024-04-09 15:36:36.971106 IP 192.168.191.128.2222 > 192.168.191.130.44852: Flags [P.], seq 13256:13320, ack 6417, win 249, options [nop,nop,TS val 1995022085 ecr 1103571992], length 64
2024-04-09 15:36:36.971313 IP 192.168.191.130.44852 > 192.168.191.128.2222: Flags [.], ack 13320, win 501, options [nop,nop,TS val 1103571992 ecr 1995022085], length 0
2024-04-09 15:36:37.028523 IP 192.168.191.130.44852 > 192.168.191.128.2222: Flags [P.], seq 6417:6481, ack 13320, win 501, options [nop,nop,TS val 1103572050 ecr 1995022085], length 64
