2024-04-09 15:35:31.343483 IP 192.168.191.130.39488 > 192.168.191.128.2222: Flags [S], seq 1966554739, win 64240, options [mss 1460,sackOK,TS val 1103506365 ecr 0,nop,wscale 7], length 0
2024-04-09 15:35:31.343577 IP 192.168.191.128.2222 > 192.168.191.130.39488: Flags [S.], seq 4206789830, ack 1966554740, win 31856, options [mss 1460,sackOK,TS val 1994956457 ecr 1103506365,nop,wscale 7], length 0
2024-04-09 15:35:31.343813 IP 192.168.191.130.39488 > 192.168.191.128.2222: Flags [.], ack 1, win 502, options [nop,nop,TS val 1103506366 ecr 1994956457], length 0
2024-04-09 15:35:31.344027 IP 192.168.191.130.39488 > 192.168.191.128.2222: Flags [P.], seq 1:33, ack 1, win 502, options [nop,nop,TS val 1103506366 ecr 1994956457], length 32
2024-04-09 15:35:31.344053 IP 192.168.191.128.2222 > 192.168.191.130.39488: Flags [.], ack 33, win 249, options [nop,nop,TS val 1994956457 ecr 1103506366], length 0